{
  "$schema": "http://json-schema.org/draft-07/schema#",
  "title": "EngineStatus",
  "description": "Where the engine is in the match it is following.",
  "type": "object",
  "properties": {
    "schema_version": { "$ref": "common.schema.json#/definitions/SchemaVersion" },
    "state": {
      "title": "EngineState",
      "description": "`waiting` for a match; `rebuilding` state from events that already happened (after a seek or a mid-match connect); `live`, following the broadcast as it happens; `playing` behind live, at the viewer's speed; `paused`; or the viewer has reached the end of the match (`ended`).",
      "type": "string",
      "enum": ["waiting", "rebuilding", "live", "playing", "paused", "ended"]
    },
    "generation": {
      "description": "The generation of the last MatchReset.",
      "type": "integer",
      "minimum": 0
    },
    "match_id": { "$ref": "common.schema.json#/definitions/MatchId" },
    "teams": {
      "description": "The teams seen so far, in order of first appearance.",
      "type": "array",
      "items": { "$ref": "common.schema.json#/definitions/Team" },
      "maxItems": 2
    },
    "period": {
      "description": "Period of the latest event processed: where the viewer is.",
      "$ref": "common.schema.json#/definitions/Period"
    },
    "match_clock_s": {
      "description": "Game clock of the latest event processed.",
      "$ref": "common.schema.json#/definitions/MatchClockSeconds"
    },
    "play_s": {
      "description": "Seconds of play so far, continuous across periods.",
      "type": "number",
      "minimum": 0
    },
    "speed": {
      "description": "The viewer's playback speed while behind live.",
      "type": "number",
      "exclusiveMinimum": 0
    },
    "live_edge": {
      "title": "LiveEdge",
      "description": "The latest point of the broadcast received so far: the viewer can seek up to here.",
      "type": "object",
      "properties": {
        "offset": {
          "description": "Events received so far.",
          "$ref": "common.schema.json#/definitions/Offset"
        },
        "period": { "$ref": "common.schema.json#/definitions/Period" },
        "match_clock_s": { "$ref": "common.schema.json#/definitions/MatchClockSeconds" },
        "play_s": {
          "description": "Seconds of play up to the live edge, continuous across periods.",
          "type": "number",
          "minimum": 0
        }
      },
      "required": ["offset", "period", "match_clock_s", "play_s"]
    },
    "behind_live_s": {
      "description": "Seconds of play between the viewer and the live edge.",
      "type": "number",
      "minimum": 0
    },
    "rebuilding_to": {
      "description": "While `rebuilding`: the offset where live play resumes.",
      "$ref": "common.schema.json#/definitions/Offset"
    },
    "released": {
      "description": "Events processed, in match-time order.",
      "type": "integer",
      "minimum": 0
    },
    "buffered": {
      "description": "Events held back for reordering.",
      "type": "integer",
      "minimum": 0
    },
    "late_dropped": {
      "description": "Events dropped for arriving too late to reorder.",
      "type": "integer",
      "minimum": 0
    },
    "duplicates": {
      "description": "Duplicate events ignored.",
      "type": "integer",
      "minimum": 0
    }
  },
  "required": ["schema_version", "state", "generation", "released", "buffered", "late_dropped", "duplicates"]
}
